{
  "schemaVersion": 1,
  "updatedOn": "2026-10-10",
  "releaseStatus": "research-preview",
  "publicDataOnly": true,
  "notes": [
    "Source row indices 1–31 are NOT yet mapped to the in-game 1★ T1..5 progression; a wrong offset would corrupt recommendations.",
    "No conquest base values at each hero level 1–80 are available. Null signifies unknown, never zero.",
    "Source skill effects are not damage multipliers and should not be added together without a verified Bear combat model.",
    "No player IDs, player names, account data, private inputs or screenshot evidence belong in this repository."
  ],
  "records": [
    {
      "id": "olive",
      "name": "Olive",
      "troopType": "archer",
      "generation": null,
      "status": "metadata-only",
      "source": {
        "catalog": "bear/catalog.js",
        "stats": null,
        "verifiedOn": null
      },
      "starProgression": null,
      "expeditionSkills": [],
      "conquestBaseByHeroLevel": null
    },
    {
      "id": "edwin",
      "name": "Edwin",
      "troopType": "cavalry",
      "generation": null,
      "status": "metadata-only",
      "source": {
        "catalog": "bear/catalog.js",
        "stats": null,
        "verifiedOn": null
      },
      "starProgression": null,
      "expeditionSkills": [],
      "conquestBaseByHeroLevel": null
    },
    {
      "id": "forrest",
      "name": "Forrest",
      "troopType": "infantry",
      "generation": null,
      "status": "metadata-only",
      "source": {
        "catalog": "bear/catalog.js",
        "stats": null,
        "verifiedOn": null
      },
      "starProgression": null,
      "expeditionSkills": [],
      "conquestBaseByHeroLevel": null
    },
    {
      "id": "seth",
      "name": "Seth",
      "troopType": "infantry",
      "generation": null,
      "status": "metadata-only",
      "source": {
        "catalog": "bear/catalog.js",
        "stats": null,
        "verifiedOn": null
      },
      "starProgression": null,
      "expeditionSkills": [],
      "conquestBaseByHeroLevel": null
    },
    {
      "id": "quinn",
      "name": "Quinn",
      "troopType": "archer",
      "generation": null,
      "status": "metadata-only",
      "source": {
        "catalog": "bear/catalog.js",
        "stats": null,
        "verifiedOn": null
      },
      "starProgression": null,
      "expeditionSkills": [],
      "conquestBaseByHeroLevel": null
    },
    {
      "id": "diana",
      "name": "Diana",
      "troopType": "archer",
      "generation": null,
      "status": "metadata-only",
      "source": {
        "catalog": "bear/catalog.js",
        "stats": null,
        "verifiedOn": null
      },
      "starProgression": null,
      "expeditionSkills": [],
      "conquestBaseByHeroLevel": null
    },
    {
      "id": "amane",
      "name": "Amane",
      "troopType": "archer",
      "generation": null,
      "status": "metadata-only",
      "source": {
        "catalog": "bear/catalog.js",
        "stats": null,
        "verifiedOn": null
      },
      "starProgression": null,
      "expeditionSkills": [],
      "conquestBaseByHeroLevel": null
    },
    {
      "id": "yeonwoo",
      "name": "Yeonwoo",
      "troopType": "archer",
      "generation": null,
      "status": "metadata-only",
      "source": {
        "catalog": "bear/catalog.js",
        "stats": null,
        "verifiedOn": null
      },
      "starProgression": null,
      "expeditionSkills": [],
      "conquestBaseByHeroLevel": null
    },
    {
      "id": "gordon",
      "name": "Gordon",
      "troopType": "cavalry",
      "generation": null,
      "status": "metadata-only",
      "source": {
        "catalog": "bear/catalog.js",
        "stats": null,
        "verifiedOn": null
      },
      "starProgression": null,
      "expeditionSkills": [],
      "conquestBaseByHeroLevel": null
    },
    {
      "id": "chenko",
      "name": "Chenko",
      "troopType": "cavalry",
      "generation": null,
      "status": "metadata-only",
      "source": {
        "catalog": "bear/catalog.js",
        "stats": null,
        "verifiedOn": null
      },
      "starProgression": null,
      "expeditionSkills": [],
      "conquestBaseByHeroLevel": null
    },
    {
      "id": "fahd",
      "name": "Fahd",
      "troopType": "cavalry",
      "generation": null,
      "status": "metadata-only",
      "source": {
        "catalog": "bear/catalog.js",
        "stats": null,
        "verifiedOn": null
      },
      "starProgression": null,
      "expeditionSkills": [],
      "conquestBaseByHeroLevel": null
    },
    {
      "id": "howard",
      "name": "Howard",
      "troopType": "infantry",
      "generation": null,
      "status": "metadata-only",
      "source": {
        "catalog": "bear/catalog.js",
        "stats": null,
        "verifiedOn": null
      },
      "starProgression": null,
      "expeditionSkills": [],
      "conquestBaseByHeroLevel": null
    },
    {
      "id": "saul",
      "name": "Saul",
      "troopType": "archer",
      "generation": null,
      "status": "metadata-only",
      "source": {
        "catalog": "bear/catalog.js",
        "stats": null,
        "verifiedOn": null
      },
      "starProgression": null,
      "expeditionSkills": [],
      "conquestBaseByHeroLevel": null
    },
    {
      "id": "jabel",
      "name": "Jabel",
      "troopType": "cavalry",
      "generation": null,
      "status": "metadata-only",
      "source": {
        "catalog": "bear/catalog.js",
        "stats": null,
        "verifiedOn": null
      },
      "starProgression": null,
      "expeditionSkills": [],
      "conquestBaseByHeroLevel": null
    },
    {
      "id": "helga",
      "name": "Helga",
      "troopType": "infantry",
      "generation": null,
      "status": "metadata-only",
      "source": {
        "catalog": "bear/catalog.js",
        "stats": null,
        "verifiedOn": null
      },
      "starProgression": null,
      "expeditionSkills": [],
      "conquestBaseByHeroLevel": null
    },
    {
      "id": "amadeus",
      "name": "Amadeus",
      "troopType": "infantry",
      "generation": null,
      "status": "metadata-only",
      "source": {
        "catalog": "bear/catalog.js",
        "stats": null,
        "verifiedOn": null
      },
      "starProgression": null,
      "expeditionSkills": [],
      "conquestBaseByHeroLevel": null
    },
    {
      "id": "marlin",
      "name": "Marlin",
      "troopType": "archer",
      "generation": null,
      "status": "metadata-only",
      "source": {
        "catalog": "bear/catalog.js",
        "stats": null,
        "verifiedOn": null
      },
      "starProgression": null,
      "expeditionSkills": [],
      "conquestBaseByHeroLevel": null
    },
    {
      "id": "hilde",
      "name": "Hilde",
      "troopType": "cavalry",
      "generation": null,
      "status": "metadata-only",
      "source": {
        "catalog": "bear/catalog.js",
        "stats": null,
        "verifiedOn": null
      },
      "starProgression": null,
      "expeditionSkills": [],
      "conquestBaseByHeroLevel": null
    },
    {
      "id": "zoe",
      "name": "Zoe",
      "troopType": "infantry",
      "generation": 2,
      "status": "partial-sourced",
      "source": {
        "catalog": "bear/catalog.js",
        "stats": "https://kingshotdata.com/heroes/zoe/",
        "verifiedOn": "2026-10-10"
      },
      "starProgression": {
        "sourceRowIndices": "1..31",
        "rowToDisplayStarTier": "unverified",
        "expeditionAttackPercent": [
          30.3,
          33.12,
          35.94,
          38.76,
          41.58,
          44.4,
          49.48,
          53.42,
          57.37,
          61.32,
          65.27,
          69.22,
          76.32,
          81.84,
          87.37,
          92.9,
          98.42,
          103.96,
          113.9,
          121.64,
          129.37,
          137.11,
          144.85,
          152.59,
          166.52,
          177.35,
          188.18,
          199.02,
          209.86,
          220.69,
          240.19
        ],
        "expeditionDefensePercent": [
          30.3,
          33.12,
          35.94,
          38.76,
          41.58,
          44.4,
          49.48,
          53.42,
          57.37,
          61.32,
          65.27,
          69.22,
          76.32,
          81.84,
          87.37,
          92.9,
          98.42,
          103.96,
          113.9,
          121.64,
          129.37,
          137.11,
          144.85,
          152.59,
          166.52,
          177.35,
          188.18,
          199.02,
          209.86,
          220.69,
          240.19
        ],
        "shardsToNextRow": [
          0,
          1,
          1,
          2,
          2,
          2,
          2,
          5,
          5,
          5,
          5,
          5,
          15,
          15,
          15,
          15,
          15,
          15,
          40,
          40,
          40,
          40,
          40,
          40,
          100,
          100,
          100,
          100,
          100,
          100,
          100
        ]
      },
      "expeditionSkills": [
        {
          "name": "Sundering Wound",
          "effect": "damage_over_time",
          "metric": "damage_percent",
          "valuesBySkillLevel": [
            8,
            16,
            24,
            32,
            40
          ],
          "conditions": {
            "procChancePercent": 20,
            "durationTurns": 3
          }
        },
        {
          "name": "Charisma",
          "effect": "squad_attack_buff",
          "metric": "attack_percent",
          "valuesBySkillLevel": [
            5,
            10,
            15,
            20,
            25
          ],
          "conditions": {}
        },
        {
          "name": "Infinite Arsenal",
          "effect": "enemy_damage_taken_debuff",
          "metric": "amplification_percent",